code,term
374221000000101,Application by prisoner to see dentist (procedure)
374211000000107,Application by prisoner to see clinic nurse (procedure)
374201000000105,Application by prisoner to see doctor (procedure)
374501000000108,Prison sickness certificate issued (finding)
362751000000101,Hepatitis C screening positive (finding)
362851000000109,Hepatitis B screening negative (finding)
362881000000103,Urine screen for gonorrhoea (procedure)
362421000000102,Chronic hepatitis annual review (regime/therapy)
362491000000104,Hepatitis C screening negative (finding)
363091000000104,Counselling for genital herpes screening (procedure)
364771000000102,Treatment of recurrent genital herpes (procedure)
442487003,Screening for Chlamydia trachomatis (procedure)
510891000000104,Hepatitis B core antibody positive (finding)
444953004,Medically fit for prison transfer (finding)
511351000000108,Medically fit for activity outside prison (finding)
443633009,Conceived by in vitro fertilization (finding)
504751000000108,Chlamydia screening programme test kit issued (finding)
504871000000109,Human immunodeficiency virus monitoring (regime/therapy)
504901000000109,Human immunodeficiency virus annual review (regime/therapy)
504931000000103,Human immunodeficiency virus positive general health check service declined (situation)
516021000000108,Discussion about domestic abuse for maternal wellbeing (procedure)
704007002,No history of sexually transmitted infectious disease (situation)
522161000000108,No history of venereal disease (situation)
749781000000109,Incomplete termination of pregnancy (disorder)
699231000,Domestic abuse not discussed (situation)
754591000000103,Rapid human immunodeficiency virus antibody test (procedure)
760421000000100,Hepatitis C viral ribonucleic acid polymerase chain reaction positive (finding)
761201000000101,Endoscopic bilateral placement of intrafallopian implants (procedure)
389094009,Infertility care (regime/therapy)
472859009,Taking anal swab for chlamydia (procedure)
707982002,Taking throat swab for chlamydia (procedure)
776591000000105,Throat swab for chlamydia (procedure)
472860004,Taking anal swab for gonorrhoea (procedure)
776661000000100,Throat swab for gonorrhoea (procedure)
386394001,Pregnancy termination care (regime/therapy)
472954000,History of chlamydial infection (situation)
764261000000100,History of chlamydia infection (situation)
764281000000109,History of gonorrhoea (situation)
765291000000105,History of in-vitro fertilisation (situation)
765741000000106,Medically unfit for prison transfer (finding)
784861000000102,Referral to domestic abuse agency (procedure)
786221000000101,In-house genitourinary medicine (procedure)
786251000000106,In-house genitourinary medicine first appointment (procedure)
707998009,Assessment for termination of pregnancy (procedure)
768721000000107,Assessment for termination of pregnancy (procedure)
448374002,Inhibition of nucleic acid amplification test for Chlamydia trachomatis (finding)
768801000000109,Human immunodeficiency virus test not appropriate (finding)
768841000000107,Post exposure prophylaxis after sexual exposure (procedure)
769411000000104,Self referral to termination of pregnancy service (procedure)
448543003,Transmyometrial transfer of embryo to uterus (procedure)
787781000000107,In-house genitourinary medicine follow-up appointment (procedure)
787801000000108,In-house genitourinary medicine discharge (procedure)
794151000000106,Chlamydia trachomatis (lymphogranuloma venereum serovar) deoxyribonucleic acid detection (procedure)
1000261000000105,Chlamydia trachomatis (lymphogranuloma venereum serovar) deoxyribonucleic acid detection (observable entity)
812161000000102,Hepatitis C antigen negative (finding)
812181000000106,Hepatitis C antigen positive (finding)
40946000,Hepatic coma due to viral hepatitis (disorder)
111896003,Viral hepatitis without hepatic coma (disorder)
817381000000107,Referral to community human immunodeficiency virus nurse specialist (procedure)
817771000000106,Detection of Chlamydia trachomatis by nucleic acid amplification test (procedure)
818821000000104,Detection of Treponema pallidum by nucleic acid amplification test (procedure)
809201000000102,Mother hepatitis B positive (situation)
823111000000102,Treponema pallidum deoxyribonucleic acid detection (procedure)
1004141000000107,Treponema pallidum deoxyribonucleic acid detection (observable entity)
824841000000105,Hepatitis C genotype 1 (disorder)
824851000000108,Hepatitis C genotype 2 (disorder)
824871000000104,Hepatitis C genotype 3 (disorder)
824881000000102,Hepatitis C genotype 4 (disorder)
824891000000100,Hepatitis C genotype 5 (disorder)
824901000000104,Hepatitis C genotype 6 (disorder)
829241000000108,12 week virologic response to hepatitis C treatment (situation)
829691000000100,History of hepatitis C antiviral drug therapy (situation)
829731000000106,On hepatitis C treatment plan (finding)
835261000000109,Sexually transmitted infection screening offered (finding)
835401000000109,Discussion about human immunodeficiency virus post exposure prophylaxis (procedure)
439057000,Education about sexually transmitted disease prevention (procedure)
46898007,Serologic test for herpes simplex (procedure)
839551000000107,Consultation for complex sexual health need (procedure)
861951000000107,History of syphilis (situation)
1087151000119108,History of syphilis (situation)
862181000000105,History of trichomoniasis (situation)
862191000000107,Seen by community human immunodeficiency virus nurse (finding)
263891000,Syphilitic (qualifier value)
264405000,Erysipelothrix chlamydia (organism)
265062002,Dilation of cervix uteri and curettage of products of conception from uterus (procedure)
265063007,Curettage of products of conception from uterus NEC (procedure)
451014004,Curettage of products of conception from uterus (procedure)
265064001,Intrauterine artificial insemination (procedure)
265082003,Laparoscopic oocyte recovery (procedure)
266563005,Non-venereal urethritis (disorder)
266609001,Female infertility of anovulatory origin (disorder)
6738008,Female infertility (disorder)
266679002,Infertility (& [female] or [primary] or [secondary]) (disorder)
297106006,Primary infertility (finding)
297121000,Secondary infertility (finding)
265633004,Selective destruction of fetus (procedure)
58533008,Artificial insemination (procedure)
87915002,Married (finding)
13184001,Separated (finding)
125681006,Single person (finding)
266944002,Has a prison record (finding)
266945001,Broken with partner (finding)
266948004,Has a criminal record (finding)
105568001,In prison (finding)
266974005,Human immunodeficiency virus risk lifestyle (finding)
267014009,History of abortion (situation)
713651007,History of pregnancy with abortive outcome (situation)
8098009,Syphilis and other venereal diseases (disorder)
266124009,Sexually transmitted infectious disease (disorder)
266125005,Early congenital syphilis with symptoms (disorder)
266126006,Late congenital neurosyphilis (disorder)
76795007,Acute type B viral hepatitis (disorder)
266127002,Primary syphilis (disorder)
266128007,Rash of secondary syphilis (disorder)
266129004,Secondary syphilis of viscera or bone (navigational concept)
266130009,Acquired syphilis - early latent (disorder)
83883001,Cardiovascular syphilis (disorder)
266131008,Late cardiovascular syphilis (disorder)
67391006,Syphilitic endocarditis (disorder)
266133006,Late quaternary neurosyphilis (disorder)
51928006,Tabes dorsalis (disorder)
266134000,General paresis - neurosyphilis (disorder)
316841006,Tabes dorsalis (disorder)
51928006,General paresis - neurosyphilis (disorder)
57019003,Verruca vulgaris (disorder)
266113007,Genital warts (disorder)
266136003,Acquired syphilis - late latent (disorder)
302812006,Anogenital human papillomavirus infection (disorder)
76272004,Other and unspecified syphilis (disorder)
266114001,Syphilis (disorder)
266137007,Perianal warts (disorder)
30168008,Acute gonococcal epididymo-orchitis (disorder)
266138002,Gonococcal synovitis or tenosynovitis (disorder)
44743006,Gonococcal joint infection NOS (disorder)
62479008,Gonococcal infection of joint (disorder)
266139005,Acquired immune deficiency syndrome (disorder)
15628003,Other gonococcal infection of other specified site (disorder)
266140007,Gonorrhea (disorder)
15628003,Gonococcal infection of other site NOS (disorder)
266141006,Gonorrhea (disorder)
15628003,Gonococcal infections NOS (disorder)
266142004,Gonorrhea (disorder)
266143009,Chancroid (disorder)
28867007,Granuloma inguinale (disorder)
35089004,Unspecified urogenital trichomonas (disorder)
266164008,Urogenital infection caused by Trichomonas vaginalis (disorder)
81598001,Trichomonal vulvovaginitis (disorder)
57019003,Viral warts (& [condyloma acuminatum]) (disorder)
240542006,Verruca vulgaris (disorder)
266198004,Anogenital warts (disorder)
57019003,Other viral warts (disorder)
266199007,Verruca vulgaris (disorder)
2576002,Trachoma (disorder)
75116005,Ornithosis (disorder)
266200005,(AIDS with viral/chlamydial dis NOS) or (ornithosis) or (trachoma) (disorder)
62479008,Acquired immune deficiency syndrome (& [ARC]) (disorder)
266201009,Acquired immune deficiency syndrome (disorder)
79974007,Cat scratch disease (disorder)
231861005,Chlamydial conjunctivitis (disorder)
266202002,(Viral and chlamydial disease NOS) or (catscratch fever) or (conjunctivitis: [chlamydia] or [trachoma]) (disorder)
36653000,(Rubella [& German measles]) or (Roseola) (disorder)
266192003,Rubella (disorder)
8098009,(Venereal &/or spirochaete diseases [& syphilis]) or (STDs) (disorder)
266208003,Sexually transmitted infectious disease (disorder)
286882004,Syphilitic/venereal/spirochetal disease (disorder)
66071002,Serum hepatitis (disorder)
266195001,Viral hepatitis type B (disorder)
26039008,Neurosyphilis (& [GPI] or [tabes dorsalis]) (disorder)
51928006,Neurosyphilis (disorder)
266210001,General paresis - neurosyphilis (disorder)
316841006,Tabes dorsalis (disorder)
76272004,Other syphilis (disorder)
266211002,Syphilis (disorder)
67224007,(Other venereal/spirochaete disease) or (Reiter's syndrome) (disorder)
266212009,Reiter's disease (disorder)
70647001,Spirochaete disease: [other venereal] or [Vincent's angina] or [chancroid] or [leptospirosis] or [lymphogranuloma venereum] or [trench mouth] or [Weil's disease] or [Yaws] (disorder)
77377001,Yaws (disorder)
186946009,Leptospirosis (disorder)
266143009,Lymphogranuloma venereum (disorder)
266213004,Chancroid (disorder)
398067003,Weil's disease (disorder)
399050001,Acute necrotizing ulcerative gingivitis (disorder)
16607004,Missed abortion (disorder)
44979007,Carneous mole (disorder)
39406005,Legally induced abortion (disorder)
57797005,Induced termination of pregnancy (disorder)
267192009,Legal abortion (disorder)
285409006,Medical termination of pregnancy (procedure)
386639001,Termination of pregnancy (procedure)
267193004,Incomplete legal abortion (disorder)
267194005,Complete legal abortion (disorder)
49632008,Illegally induced abortion (disorder)
198861000,"Readmission for retained products of conception, spontaneous abortion (disorder)"
267195006,Readmission for abortive pregnancy National Health Service codes (disorder)
363681007,Pregnancy with abortive outcome (disorder)
57797005,Induced termination of pregnancy (disorder)
39406005,Legally induced abortion (disorder)
267296001,Termination of pregnancy (& [legal]): finding or procedure (disorder)
386639001,Termination of pregnancy (procedure)
17369002,Miscarriage (disorder)
267297005,Abortion NOS (disorder)
363681007,Pregnancy with abortive outcome (disorder)
267300000,Infection: [genital &/or pelvic] or [post abortion] (disorder)
267301001,Haemorrhage: [delayed &/or excessive] or [post abortion] (disorder)
609448007,Induced termination of pregnancy complicated by delayed and/or excessive hemorrhage (disorder)
27942005,Shock (disorder)
267302008,Shock (& [post abortion]) (disorder)
55584005,Embolus (morphologic abnormality)
267303003,Embolism (& [post abortion]) (disorder)
198609003,Post-abortion problem NOS (disorder)
267304009,"Complication of pregnancy, childbirth and/or the puerperium (disorder)"
17369002,Miscarriage (disorder)
267294003,Abortion: [spontaneous] or [complete] or [incomplete] (disorder)
267316003,Pregnancy with venereal disease (& [gonorrhoea] or [syphilis]) (disorder)
274118001,Venereal disease in pregnancy (disorder)
4129001,(Abnormal pupil or [pupils]) &/or Adie pupil &/or Argyll-Robertson pupil &/or miosis not due to miotics (finding)
24225004,Argyll-Robertson pupil (finding)
267749005,Tonic pupillary reaction (disorder)
274093008,Abnormal pupil (finding)
267883008,Post-genitourinary infection reactive arthritis (disorder)
268842008,Neonatal dacryocystitis or conjunctivitis caused by chlamydiae (disorder)
269285002,Emotional abuse of child (disorder)
371775004,Emotional abuse of child (event)
68150004,Victim of child abuse (finding)
158094009,Non-accidental injury to child (disorder)
270552003,(Non-accidental injury to child) or (battered baby/child) (disorder)
397940009,Victim of child abuse (finding)
269286001,Child maltreatment syndrome NOS (finding)
397940009,Victim of child abuse (finding)
213015009,Maltreatment syndromes (disorder)
269306000,[X]Other maltreatment syndromes classification terms (disorder)
452781000000109,[X]Other maltreatment syndromes classification terms (disorder)
268505009,Venereal disease contact (finding)
464851000000107,[V]Contact with or exposure to venereal disease (situation)
268593006,HIV contact (& [AIDS]) (finding)
444356002,Exposure to Human immunodeficiency virus (event)
66598005,Venereal disease carrier (& [NOS]) (finding)
268594000,Infectious disease carrier (finding)
269812004,[V]Menstrual extraction (situation)
444361000000109,[V]Menstrual extraction (situation)
269828009,Syphilis infectious titer test (procedure)
1015571000000106,Syphilis infectious titre test (observable entity)
269829001,Treponema pallidum hemaglutination test (procedure)
1015601000000104,Treponema pallidum haemagglutination test (observable entity)
269828009,Syphilis titer test NOS (procedure)
269830006,Syphilis infectious titer test (procedure)
47758006,SH-antigen (hepatitis B) test (procedure)
269835001,Hepatitis B surface antigen measurement (procedure)
991971000000109,SH-antigen hepatitis B test (observable entity)
269964006,Cervical smear - wart virus (finding)
9391000000101,HSA1 therapeutic abortion green form (record artifact)
9401000000103,HSA1 form eligible (finding)
9411000000101,HSA1 form signed (finding)
9421000000107,HSA1 form refused to sign (finding)
13961000000108,HSA1 form status (finding)
270552003,(Non-accidental injury to child) or (battered baby/child) (disorder)
397940009,Victim of child abuse (finding)
271338008,Lymphogranuloma venereum antigen skin test (procedure)
102457005,Battered baby AND/OR child syndrome (finding)
271377006,Battered baby or child syndrome NOS (finding)
726251000000104,"GP22 deregistration - adopted, re-registered with new name (finding)"
271394008,History of - venereal disease (situation)
275881005,History of sexually transmitted disease (situation)
10641000000105,Form A - therapeutic abortion (record artifact)
10651000000108,Form A therapeutic abortion - eligible (finding)
10661000000106,Form A therapeutic abortion - signed (finding)
10671000000104,Form A therapeutic abortion - refused to sign (finding)
13971000000101,Form A therapeutic abortion form status (finding)
271426000,Non-venereal endemic syphilis (disorder)
33839006,Genital herpes unspecified (disorder)
271463009,Genital herpes simplex (disorder)
271511000,Hepatitis B immune (finding)
71011005,Infestation caused by Phthirus pubis (disorder)
267014009,History of abortion (situation)
271904006,History of - fetal loss (context-dependent category)
713651007,History of pregnancy with abortive outcome (situation)
273263000,Acquired immunodeficiency syndrome risk behavior knowledge test (assessment scale)
271954000,Failed attempted medical abortion (disorder)
11087003,Abortion with complication (finding)
609446006,Induced termination of pregnancy with complication (disorder)
272006008,Gonococcal arthritis dermatitis syndrome (disorder)
273454004,Fear of acquired immunodeficiency syndrome scale (assessment scale)
274118001,Venereal disease in pregnancy (disorder)
276092001,Arrested in police custody (finding)
276091008,Vandalism record (finding)
125680007,Marital status (observable entity)
276124005,Marital status (finding)
276125006,Separated from cohabitee (finding)
276126007,Husband left home (finding)
276127003,Wife left home (finding)
276128008,Cohabitee left home (finding)
276129000,Spouse left home (finding)
274684006,False-positive serological test for syphilis (finding)
274972007,Dilatation of cervix and curettage of retained products of conception (procedure)
274973002,Dilation of cervix uteri and curettage for termination of pregnancy (procedure)
56118002,Congenital syphilitic splenomegaly (disorder)
59721007,Congenital syphilitic pemphigus (disorder)
58392004,Congenital syphilitic osteochondritis (disorder)
192008,Congenital syphilitic hepatomegaly (disorder)
275376007,Congenital syphilitic chronic coryza (disorder)
27648007,Congenital syphilitic periostitis (disorder)
63751007,Secondary syphilis of bone (disorder)
58227000,Secondary syphilis of viscera (disorder)
31207002,Self-induced abortion (disorder)
49416000,Failed attempted abortion (disorder)
275423001,Failed abortion (disorder)
275424007,Infection - post-abortion (disorder)
609510000,Induced termination of pregnancy complicated by infectious disease (disorder)
267014009,History of abortion (situation)
275567001,History of - termination (context-dependent category)
713651007,History of pregnancy with abortive outcome (situation)
275755000,Venereal Disease Research Laboratory titer measurement (procedure)
275881005,History of sexually transmitted disease (situation)
122366001,Hepatitis C virus RNA assay (procedure)
390744008,Hepatitis C virus ribonucleic acid assay (procedure)
1012941000000104,Hepatitis C virus ribonucleic acid assay (observable entity)
72083004,Late syphilis (disorder)
276200006,Late syphilis (disorder)
315655009,[V]Contact with or exposure to venereal disease (situation)
464851000000107,[V]Contact with or exposure to venereal disease (situation)
165815009,[V]Human immunodeficiency virus - negative (situation)
315657001,Human immunodeficiency virus negative (finding)
480171000000102,[V]Human immunodeficiency virus - negative (situation)
315658006,[V]Contact with and exposure to human immunodeficiency virus (situation)
428541000000106,[V]Contact with and exposure to human immunodeficiency virus (situation)
315659003,[V]Asymptomatic human immunodeficiency virus infection status (situation)
427921000000108,[V]Asymptomatic human immunodeficiency virus infection status (situation)
315660008,[V]Contact with and exposure to viral hepatitis (situation)
444491009,Exposure to viral hepatitis (event)
398121000000106,[V]Contact with and exposure to viral hepatitis (situation)
170489004,[V]Viral hepatitis carrier (situation)
315672002,Viral hepatitis carrier (finding)
441121000000101,[V]Viral hepatitis carrier (situation)
170490008,[V]Gonorrhea carrier (situation)
315674001,Gonorrhea carrier (finding)
428141000000103,[V]Gonorrhea carrier (situation)
315675000,[V]Other venereal disease carrier (situation)
440291000000103,[V]Other venereal disease carrier (situation)
315676004,[V]Carrier of human T-lymphotropic virus type-1 infect (situation)
427251000000107,[V]Carrier of human T-lymphotropic virus type-1 infect (situation)
315855007,[V]Family history of human immunodefiency virus [HIV] disease (situation)
438998000,[V]Family history of human immunodeficiency virus disease (situation)
480411000000100,Family history of human immunodeficiency virus infection (situation)
315908001,[V]Pregnancy with history of infertility (situation)
439801000000103,[V]Pregnancy with history of infertility (situation)
315910004,[V]Pregnancy with history of abortion (situation)
427511000000106,[V]Pregnancy with history of abortion (situation)
315937002,[V]Admission for administration of abortifacient (situation)
439741000000107,[V]Admission for administration of abortifacient (situation)
315945007,[V]Infertility management (situation)
441181000000100,[V]Infertility management (situation)
315947004,[V]Artificial insemination NOS (situation)
427961000000100,[V]Artificial insemination NOS (situation)
11900001,Semen analysis (procedure)
50020006,Inflation of fallopian tube (procedure)
87727006,Infertility study (procedure)
302792004,Sperm count (procedure)
315948009,[V]Infertility investigation and testing (situation)
479611000000102,[V]Infertility investigation and testing (situation)
315950001,[V]Infertility general advice and counseling (situation)
411171000000106,[V]Infertility general advice and counselling (situation)
315951002,[V]Artificial insemination from husband (situation)
451871000000106,[V]Artificial insemination from husband (situation)
236896006,[V]Artificial insemination from donor (situation)
315952009,Artificial insemination by donor (procedure)
410381000000104,[V]Artificial insemination from donor (situation)
315953004,[V]In vitro fertilization (situation)
440691000000100,[V]In vitro fertilisation (situation)
315954005,[V]Other assisted fertilization methods (situation)
411101000000103,[V]Other assisted fertilisation methods (situation)
315955006,[V]Other specified infertility management (situation)
399071000000103,[V]Other specified infertility management (situation)
315956007,[V]Unspecified infertility management (situation)
427641000000106,[V]Unspecified infertility management (situation)
316206001,[V]Problems related to alleged sex abuse child by person within primary support group (situation)
443251000000101,[V]Problems related to alleged sex abuse child by person within primary support group (situation)
316207005,[V]Problems related to alleged physical abuse of child (situation)
417241000000101,[V]Problems related to alleged physical abuse of child (situation)
316226002,[V]Problems related to release from prison (situation)
288561000119106,Problem related to release from prison (finding)
479831000000106,[V]Problems related to release from prison (situation)
28332004,Family disruption (finding)
316375003,[V]Family disruption (situation)
444741000000107,[V]Family disruption (situation)
316377006,[V]Child abuse (situation)
430531000000101,[V]Child abuse (situation)
22268004,Legal problem (finding)
45361006,Imprisonment (finding)
316395009,[V]Legal problems (situation)
398501000000109,[V]Imprisonment and other incarceration (situation)
426981000000107,[V]Legal problems (situation)
469291000000102,[V]Other psychosocial circumstances (situation)
45361006,Imprisonment (finding)
316399003,[V]Imprisonment and other incarceration (situation)
398501000000109,[V]Imprisonment and other incarceration (situation)
469291000000102,[V]Other psychosocial circumstances (situation)
313077009,[V]Human immunodefiency virus counseling (situation)
316492008,Human immunodeficiency virus counseling (procedure)
416421000000106,[V]Human immunodeficiency virus counselling (situation)
1640009,"History and physical examination, insurance (procedure)"
103738006,"History and physical examination, immigration (procedure)"
171351004,Driving license medical examination (procedure)
171382000,Adoption medical examination (procedure)
171392008,Prison medical examination (procedure)
316540002,[V]Other medical examination for administrative purposes (situation)
468611000000102,[V]Other medical examination for administrative purposes (situation)
316601000,[V]Special screening examination for human immunodeficiency virus (situation)
430091000000108,[V]Special screening examination for human immunodeficiency virus (situation)
316610008,[V]Screening for venereal disease (situation)
469321000000107,[V]Screening for venereal disease (situation)
316746006,[X]Other assisted fertilization methods (situation)
391241000000101,[X]Other assisted fertilisation methods (situation)
161418008,H/O: [venereal disease] or [STD] (situation)
224119007,Age spread of children in family (observable entity)
450768005,International student (occupation)
262043009,Partner in relationship (person)
789641000000103,Hospital at home patient (finding)
793161000000107,Child no longer cause for concern (finding)
819821000000107,Teenage parent (finding)
161158003,Immigrant (person)
160509003,Immigrant (person)
314381008,Approved foster parent (finding)
160510008,Approved foster parent (finding)
417430008,Vulnerable adult (finding)
416625007,Family reunion immigrant (person)
247811000000108,Vulnerable elderly person (finding)
224117009,Details of own children (observable entity)
224118004,Number of offspring (observable entity)
160862000,Boyfriend arrested (finding)
160863005,Girlfriend arrested (finding)
161703008,History of abuse (situation)
161704002,History of physical abuse (situation)
161705001,History of sexual abuse (situation)
161706000,History of emotional abuse (situation)
412732008,History of domestic violence (situation)
416081002,On sex offenders register (finding)
225830003,Victim of sexual harassment (finding)
205171000000107,Victim of domestic violence (finding)
206411000000103,Alleged perpetrator of domestic violence (finding)
850441000000102,History of being victim of domestic violence (situation)
863561000000103,Victim of human trafficking (finding)
879911000000102,Victim of domestic abuse (finding)
713834002,Victim of child sexual exploitation (finding)
920891000000103,Victim of child sexual exploitation (finding)
166200006,HIV antibody/antigen (Duo) (procedure)
166306002,HIV 1 PCR (procedure)
166074009,Chlamydia antigen test (procedure)
166075005,Chlamydia antigen by ELISA (procedure)
166076006,Chlamydia antigen ELISA positive (finding)
166077002,Chlamydia antigen ELISA negative (finding)
