code,term
64102008,Syphilitic gumma (disorder)
240580007,Gonococcal penile fistula (disorder)
240566000,Gummatous neurosyphilis (disorder)
240567009,Syphilitic coronary artery disease (disorder)
240581006,Gonococcal female pelvic infection (disorder)
5085001,Gonococcemia (disorder)
240582004,Gonococcal synovitis (disorder)
240583009,Cutaneous gonorrhea (disorder)
240584003,Gonococcal cellulitis (disorder)
240596005,Nonspecific genital infection contact (finding)
444458000,Exposure to nonspecific genital infection (event)
240585002,Chancroid - anogenital ulcer (disorder)
240586001,Chancroid - extragenital ulcer (disorder)
240587005,Chancroid - latent infection (disorder)
240597001,Anal warts (disorder)
240588000,Chancroid contact (finding)
444375007,Exposure to Haemophilus ducreyi (event)
240589008,Chlamydia trachomatis infection (disorder)
240598006,Penile warts (disorder)
240600000,Asymptomatic trichomoniasis (disorder)
240601001,Genital trichomoniasis contact (finding)
444452004,Exposure to genital trichomoniasis (event)
240602008,Early lymphogranuloma venereum (disorder)
240603003,Late lymphogranuloma venereum (disorder)
240604009,Latent lymphogranuloma venereum (disorder)
240605005,Lymphogranuloma venereum contact (finding)
444461004,Exposure to lymphogranuloma venereum (event)
240590004,Neonatal chlamydial infection (disorder)
240591000,Neonatal chlamydial conjunctivitis (disorder)
240606006,Donovanosis - anogenital ulcer (disorder)
28867007,Granuloma inguinale (disorder)
240607002,Donovanosis - inguinal lesion (disorder)
240592007,Chlamydia trachomatis infection suspected on epidemiological grounds (situation)
240608007,Donovanosis - non-genital lesion (disorder)
240593002,Chlamydia trachomatis contact (disorder)
240609004,Donovanosis contact (finding)
444358001,Exposure to Klebsiella granulomatis (event)
444418002,Exposure to Chlamydia trachomatis (event)
240594008,Genital mycoplasma infection (disorder)
240611008,Acquired immune deficiency syndrome-related complex (disorder)
81000119104,Symptomatic human immunodeficiency virus infection (disorder)
74633007,AIDS with cachexia (disorder)
422003001,Cachexia associated with acquired immunodeficiency syndrome (finding)
58002003,AIDS with myelitis (disorder)
421315006,Myelitis associated with acquired immunodeficiency syndrome (disorder)
230598008,Human immunodeficiency virus neuropathy (disorder)
240612001,Neuropathy caused by human immunodeficiency virus (disorder)
242031004,Domestic abuse (disorder)
371772001,Domestic abuse (event)
242032006,Child abuse NEC (event)
418189009,Child abuse (event)
102457005,Battered baby AND/OR child syndrome (finding)
242033001,Battered child syndrome NOS (finding)
102457005,Battered baby AND/OR child syndrome (finding)
242034007,Battered baby syndrome NOS (finding)
95922009,Child sex abuse (event)
242035008,Child neglect (finding)
418496002,Child neglect (event)
242036009,Neglect affecting child NEC (event)
418496002,Child neglect (event)
242037000,Child abandonment (event)
242038005,Abandonment of infant (event)
242039002,Abuse of partner (event)
95921002,Elderly person maltreatment (event)
242040000,Physical abuse of elderly person (event)
242041001,Emotional abuse of elderly person (event)
242042008,Deprivation of nourishment of elderly person (event)
242043003,Abandonment of elderly person (event)
242044009,Abuse of disabled person (event)
242045005,Physical abuse of disabled person (event)
242046006,Sexual abuse of disabled person (event)
242047002,Emotional abuse of disabled person (event)
242048007,Neglect of disabled person (event)
242647003,Bite of pubic louse (event)
243069004,Counseling for abuse (procedure)
243070003,Counseling for sexual abuse (procedure)
243071004,Counseling for physical abuse (procedure)
243064009,Reproductive education (procedure)
243075008,Advice on fertility and infertility (regime/therapy)
68704007,Neisseria gonorrhoeae (organism)
79265004,Fusarium chlamydosporum (organism)
89293008,Human immunodeficiency virus type I (organism)
243598007,Human immunodeficiency virus type 1 (organism)
36115006,Human immunodeficiency virus type 2 (organism)
62944002,Hepatitis C virus (organism)
60817000,Campylobacter fetus ss. venerealis (organism)
16241000,Genus Chlamydia (organism)
14590003,Chlamydophila psittaci (organism)
103514009,Chlamydophila pneumoniae (organism)
63938009,Chlamydia trachomatis (organism)
243359003,Enzootic abortion of ewes agent (organism)
169698000,Antenatal syphilis screening (procedure)
243830006,Antenatal syphilis screening categorized by action status (navigational concept)
247868009,Fear of contracting venereal disease (finding)
102920009,Fear of contracting human immunodeficiency virus infection (finding)
118201000,Finding related to development of sexuality (finding)
248089001,Development of sexual identity (finding)
248091009,Desire to become member of the opposite sex (finding)
248154001,Sexual or gender identity uncertain (finding)
422785002,Sexual identity confusion (finding)
8619003,Infertile (finding)
248989003,Number of miscarriages (observable entity)
250514000,Human immunodeficiency virus antibody titer measurement (procedure)
250510009,Syphilis antibody titer measurement (procedure)
252405003,Hepatitis B antigen screening (procedure)
1028341000000105,Hepatitis B antigen screening (observable entity)
40675008,Serologic test for syphilis (procedure)
991951000000100,Syphilis serology (observable entity)
9232009,Fluorescent treponemal antibody absorption test (procedure)
1015591000000105,Fluorescent treponemal antibody test (observable entity)
252407006,Treponema pallidum immobilization test (procedure)
87727006,Infertility study (procedure)
42862001,Sperm evaluation by hamster penetration test (procedure)
252936002,Investigations for female infertility (procedure)
252939009,Ultrasound scan for follicle monitoring (procedure)
252113007,Number of abortions (observable entity)
252114001,Number of induced abortions (observable entity)
254387007,Human immunodeficiency virus infection classification systems (staging scale)
255104003,Queyrat's erythroplasia (disorder)
398768004,Queyrat's erythroplasia (disorder)
259829003,Chlamydophila psittaci biogroup 5 antibody (substance)
259830008,Chlamydophila psittaci biogroup 6 antibody (substance)
120675001,Chlamydia species antibody (substance)
259831007,Chlamydophila psittaci biogroup 7 antibody (substance)
120652008,Chlamydia trachomatis antibody (substance)
259832000,Chlamydophila psittaci biogroup 8 antibody (substance)
120882000,Chlamydia trachomatis serotype A antibody (substance)
120658007,Chlamydia trachomatis serotype B antibody (substance)
259815004,Chlamydia trachomatis serotype Ba antibody (substance)
120708007,Chlamydia trachomatis serotype C antibody (substance)
259816003,Chlamydia trachomatis serotype D antibody (substance)
259817007,Chlamydia trachomatis serotype E antibody (substance)
120950002,Chlamydia trachomatis serotype F antibody (substance)
120951003,Chlamydia trachomatis serotype G antibody (substance)
259818002,Chlamydia trachomatis serotype H antibody (substance)
259819005,Chlamydia trachomatis serotype I antibody (substance)
259820004,Chlamydia trachomatis serotype J antibody (substance)
120952005,Chlamydia trachomatis serotype K antibody (substance)
259821000,Chlamydia trachomatis serotype L1 antibody (substance)
259822007,Chlamydia trachomatis serotype L2 antibody (substance)
120834006,Neisseria gonorrhoeae antibody (substance)
259823002,Chlamydia trachomatis serotype L3 antibody (substance)
120902001,Chlamydia pneumoniae antibody (substance)
120651001,Chlamydophila psittaci antibody (substance)
259825009,Chlamydophila psittaci biogroup 1 antibody (substance)
259826005,Chlamydophila psittaci biogroup 2 antibody (substance)
259827001,Chlamydophila psittaci biogroup 3 antibody (substance)
259828006,Chlamydophila psittaci biogroup 4 antibody (substance)
259855002,Human immunodeficiency virus antibody (substance)
120841000,Human immunodeficiency virus type 1 antibody (substance)
120842007,"Human immunodeficiency virus, type II antibody (substance)"
121002007,Chlamydia trachomatis antigen (substance)
60605004,Hepatitis B e antigen (substance)
22290004,Hepatitis B surface antigen (substance)
103093008,Human immunodeficiency virus p24 antigen (substance)
276665006,Congenital acquired immune deficiency syndrome (disorder)
276666007,Congenital human immunodeficiency virus positive status syndrome (disorder)
276668008,Congenital non-A non-B hepatitis infection (disorder)
276681001,Neonatal chlamydial dacryocystitis (disorder)
278068003,Herpetic vesicle in vagina (disorder)
276700005,Congenital syphilitic rhinitis (disorder)
276847009,Physical abuse of adult (disorder)
371778002,Physical abuse of adult (event)
276848004,Emotional abuse of adult (disorder)
371774000,Emotional abuse of adult (event)
276849007,Psychological abuse of adult (event)
276877003,Trichomonal vaginitis (disorder)
276907003,Percutaneous sperm aspiration (procedure)
312645003,Percutaneous epididymal sperm aspiration (procedure)
8098009,Venereal disease (disorder)
276972005,Sexually transmitted infectious disease (disorder)
278480000,Syphilitic endocarditis of aortic valve (disorder)
278481001,Quaternary syphilis (disorder)
278707004,Emotional deprivation of child (event)
278709001,Physical child abuse (disorder)
371779005,Physical child abuse (event)
277497008,Gonorrhea contact (finding)
444376008,Exposure to Neisseria gonorrhoeae (event)
277498003,Syphilis contact (finding)
444380003,Exposure to Treponema pallidum (event)
277499006,Complicated donovanosis (disorder)
277500002,Syphilis suspected on epidemiological grounds (disorder)
371397000,Syphilis suspected on epidemiological grounds (situation)
278836005,Remarried (finding)
278837001,Newly wed (finding)
278838006,Released from prison (finding)
278929008,Congenital hepatitis C infection (disorder)
278975000,Hepatitis C non-immune (finding)
278977008,Human immunodeficiency virus status (observable entity)
19030005,Human immunodeficiency virus (organism)
281388009,Human immunodeficiency virus-related sclerosing cholangitis (disorder)
281390005,Human immunodeficiency virus-related gut disease - cause unknown (disorder)
713300006,Disorder of gastrointestinal tract co-occurrent with human immunodeficiency virus infection (disorder)
281635007,Contact of sexually transmissible disorder (finding)
444451006,Exposure to sexually transmissible disorder (event)
281636008,Viral hepatitis contact (finding)
444491009,Exposure to viral hepatitis (event)
281638009,Hepatitis B contact (finding)
444486008,Exposure to Hepatitis B virus (event)
282272009,Gender reassignment patient (finding)
285116001,Gender identity finding (finding)
1321008,Therapeutic abortion procedure (procedure)
386639001,Termination of pregnancy (procedure)
285409006,Medical termination of pregnancy (procedure)
285434006,Insertion of abortifacient suppository (procedure)
285586000,Chlamydia swab (procedure)
40733004,Acquired immunodeficiency syndrome (AIDS) with viral/chlamydial disease NOS (disorder)
286880007,Infectious disease (disorder)
8098009,Sexually transmitted infectious disease (disorder)
286882004,Syphilitic/venereal/spirochetal disease (disorder)
40733004,Other venereal/spirochete disease (disorder)
286883009,Infectious disease (disorder)
87628006,Bacterial infectious disease (disorder)
286884003,Venereal/spirochete disease NOS (disorder)
287955003,Termination of pregnancy operation NOS (procedure)
302375005,Operative termination of pregnancy (procedure)
288041006,Other fetal pregnancy removal operation (procedure)
386639001,Termination of pregnancy (procedure)
288044003,Other fetus removal NOS (procedure)
386639001,Termination of pregnancy (procedure)
288045002,Injection of amnion for termination of pregnancy (procedure)
8619003,Infertile (finding)
289179008,Infertile (finding)
298128008,Perineal wart (disorder)
298129000,Female perineal wart (disorder)
16364000,Excision of penile wart (procedure)
301086002,Syphilitic meningitis (disorder)
301569004,Ability to mobilize using mobility aids (observable entity)
301570003,Able to mobilize using mobility aids (finding)
8098009,Sexually transmitted infectious disease (disorder)
301990003,Gonococcal seminal vesiculitis (disorder)
302180008,Prison record and criminal activity details (observable entity)
302348003,Detained in hospital under Section 48 of the Mental Health Act 1983 (England and Wales) (finding)
469651000000107,Detained in hospital under Section 48 of the Mental Health Act 1983 (England and Wales) (finding)
302380001,Detained in hospital under Section 47 of the Mental Health Act 1983 (England and Wales) (finding)
412411000000101,Detained in hospital under Section 47 of the Mental Health Act 1983 (England and Wales) (finding)
302375005,Operative termination of pregnancy (procedure)
302756003,Eloped (finding)
302812006,Anogenital human papillomavirus infection (disorder)
302813001,Syphilitic acoustic neuritis - quaternary stage (disorder)
61612001,Syphilitic aortic incompetence (disorder)
12001000000103,Complaint procedure under the Mental Health Act 1983 (England and Wales) (procedure)
12011000000101,Investigation of complaint on behalf of a detained patient by Mental Health Act Commissioner (procedure)
12021000000107,Investigation of complaint on behalf of a non-detained patient by Mental Health Act Commissioner (procedure)
58533008,Artificial insemination NEC (procedure)
303714005,Artificial insemination (procedure)
265082003,Endoscopic oocyte recovery NEC (procedure)
303718008,Laparoscopic oocyte recovery (procedure)
303233001,Hepatitis B antigen (substance)
864511000000102,Sexually transmitted infection in-house follow-up (procedure)
868191000000109,Hepatitis C antiviral treatment completed (situation)
868341000000102,Recurrent genital warts (disorder)
305975009,Referral by genitourinary medicine physician (procedure)
306033001,Referral by genitourinary nurse (procedure)
306123006,Referral to genitourinary medicine service (procedure)
872251000000104,History of genital warts (situation)
872271000000108,History of genital herpes (situation)
306282009,Referral to genitourinary physician (procedure)
306325006,Referral to genitourinary nurse (procedure)
700506009,Non-accidental traumatic head injury to child (disorder)
889021000000100,Non-accidental traumatic head injury to child (disorder)
306435004,Discharge by genitourinary medicine physician (procedure)
306500003,Discharge by genitourinary nurse (procedure)
305276001,Admission by genitourinary medicine physician (procedure)
306591007,Discharge from genitourinary medicine service (procedure)
446594000,Infection of pharynx caused by Chlamydia trachomatis (disorder)
877891000000108,Pharyngeal lymphogranuloma venereum (disorder)
447372001,Infection of rectum caused by Chlamydia trachomatis (disorder)
877911000000106,Rectal lymphogranuloma venereum (disorder)
305374000,Admission to genitourinary medicine department (procedure)
305489005,Under care of genitourinary medicine physician (finding)
894621000000106,Human immunodeficiency virus infection monitoring invitation (procedure)
894641000000104,Human immunodeficiency virus infection monitoring telephone invitation (procedure)
894661000000103,Human immunodeficiency virus infection monitoring first telephone invitation (procedure)
305562003,Under care of genitourinary nurse (finding)
894781000000104,Human immunodeficiency virus infection monitoring second telephone invitation (procedure)
894801000000103,Human immunodeficiency virus infection monitoring third telephone invitation (procedure)
702953007,Suspected victim of child neglect (situation)
879111000000100,Suspected victim of child neglect (situation)
305679000,Seen by genitourinary medicine physician (finding)
402913004,Bowenoid papulosis (disorder)
305739003,Seen by genitourinary nurse (finding)
702479006,At high risk of sexually transmitted infection (finding)
881361000000107,At high risk of sexually transmitted infection (finding)
702480009,At low risk of sexually transmitted infection (finding)
881381000000103,At low risk of sexually transmitted infection (finding)
305875008,Seen by pregnancy termination service (finding)
307097008,Cautioned by police (finding)
700255001,Suspected non-accidental injury to child (situation)
883451000000103,Suspected non-accidental injury to child (situation)
700254002,Suspected victim of child sexual abuse (situation)
883471000000107,Suspected victim of child sexual abuse (situation)
307423008,Gonococcal pelvic peritonitis (disorder)
906211000000103,Destruction of fetus (procedure)
906211000000103,Destruction of fetus (procedure)
906211000000103,Destruction of fetus (procedure)
398443000,Herpes simplex nucleic acid assay (procedure)
1030521000000108,Herpes simplex nucleic acid detection assay (observable entity)
906471000000109,Herpes simplex virus type 1 nucleic acid detection assay (procedure)
1029781000000109,Herpes simplex virus type 1 nucleic acid detection assay (observable entity)
398468003,Hepatitis B nucleic acid assay (procedure)
906491000000108,Herpes simplex virus type 2 nucleic acid detection assay (procedure)
1003991000000103,Herpes simplex virus type 2 nucleic acid detection assay (observable entity)
1031571000000101,Hepatitis B nucleic acid detection assay (observable entity)
398513000,Hepatitis C nucleic acid assay (procedure)
1030511000000102,Hepatitis C nucleic acid detection assay (observable entity)
907051000000107,Hepatitis D nucleic acid detection assay (procedure)
999731000000105,Hepatitis D nucleic acid detection assay (observable entity)
906571000000105,Human papilloma virus nucleic acid detection assay (procedure)
907091000000104,Human herpes virus 6 nucleic acid detection assay (procedure)
1029511000000109,Human papilloma virus nucleic acid detection assay (observable entity)
1029701000000104,Human herpes virus 6 nucleic acid detection assay (observable entity)
907111000000109,Human herpes virus 7 nucleic acid detection assay (procedure)
1029711000000102,Human herpes virus 7 nucleic acid detection assay (observable entity)
907171000000104,Human herpes virus 8 nucleic acid detection assay (procedure)
1029721000000108,Human herpes virus 8 nucleic acid detection assay (observable entity)
398452009,Chlamydia trachomatis nucleic acid assay (procedure)
398579006,Human immunodeficiency virus-1 nucleic acid assay (procedure)
998611000000102,Chlamydia trachomatis nucleic acid detection assay (observable entity)
1008351000000102,Human immunodeficiency virus 1 ribonucleic acid detection assay (observable entity)
398378004,Human T cell lymphotropic virus 1 nucleic acid assay (procedure)
1008331000000109,Human T-lymphotropic virus 1 ribonucleic acid detection assay (observable entity)
398614002,Human T-cell lymphotropic virus 2 nucleic acid assay (procedure)
1008311000000101,Human T-lymphotropic virus 2 ribonucleic acid detection assay (observable entity)
907251000000102,Human T-lymphotropic virus nucleic acid detection assay (procedure)
1008291000000102,Human T-lymphotropic virus ribonucleic acid detection assay (observable entity)
907521000000109,Neisseria gonorrhoeae nucleic acid detection assay (procedure)
998651000000103,Neisseria gonorrhoeae nucleic acid detection assay (observable entity)
307733001,Inevitable abortion complete (disorder)
307737000,Inevitable abortion incomplete (disorder)
59363009,Inevitable abortion (disorder)
307740000,Unspecified inevitable abortion complicated by embolism (disorder)
59363009,Inevitable abortion (disorder)
307743003,Inevitable abortion unspecified (disorder)
926851000000108,Human immunodeficiency virus drug resistance test (procedure)
1010871000000101,Human immunodeficiency virus drug resistance test (observable entity)
5211000000103,Therapeutic abortion form status (finding)
309096008,Harvest of reproductive tissue (procedure)
713059005,Young offender (finding)
931861000000102,Young offender (finding)
932981000000105,Human immunodeficiency virus type 1 subtype identification (procedure)
1007761000000101,Human immunodeficiency virus type 1 subtype identification (observable entity)
121912002,Hepatitis B virus deoxyribonucleic acid assay (procedure)
1008441000000106,Hepatitis B deoxyribonucleic acid detection assay (observable entity)
122369008,Herpes simplex virus deoxyribonucleic acid assay (procedure)
1008421000000104,Herpes simplex deoxyribonucleic acid detection assay (observable entity)
118095006,Herpes simplex virus 1 deoxyribonucleic acid assay (procedure)
1008411000000105,Herpes simplex type 1 deoxyribonucleic acid detection assay (observable entity)
118096007,Herpes simplex virus 2 deoxyribonucleic acid assay (procedure)
1008401000000108,Herpes simplex type 2 deoxyribonucleic acid detection assay (observable entity)
934411000000104,Human herpesvirus 6 deoxyribonucleic acid detection assay (procedure)
1008391000000105,Human herpesvirus 6 deoxyribonucleic acid detection assay (observable entity)
934431000000107,Human herpesvirus 7 deoxyribonucleic acid detection assay (procedure)
1008381000000108,Human herpesvirus 7 deoxyribonucleic acid detection assay (observable entity)
934451000000100,Human herpesvirus 8 deoxyribonucleic acid detection assay (procedure)
1008371000000106,Human herpesvirus 8 deoxyribonucleic acid detection assay (observable entity)
934491000000108,Human immunodeficiency virus immunoglobulin G avidity test (procedure)
1007841000000109,Human immunodeficiency virus immunoglobulin G avidity (observable entity)
117748001,Human immunodeficiency virus 1 deoxyribonucleic acid assay (procedure)
1008361000000104,Human immunodeficiency virus 1 provirus deoxyribonucleic acid detection assay (observable entity)
117752001,Human immunodeficiency virus 1 ribonucleic acid assay (procedure)
1008351000000102,Human immunodeficiency virus 1 ribonucleic acid detection assay (observable entity)
118098008,Human T-cell lymphotropic virus 1 deoxyribonucleic acid assay (procedure)
1008341000000100,Human T-lymphotropic virus 1 provirus deoxyribonucleic acid detection assay (observable entity)
934611000000101,Human T-lymphotropic virus 1 ribonucleic acid detection assay (procedure)
1008331000000109,Human T-lymphotropic virus 1 ribonucleic acid detection assay (observable entity)
118099000,Human T-cell lymphotropic virus 2 deoxyribonucleic acid assay (procedure)
1008321000000107,Human T-lymphotropic virus 2 provirus deoxyribonucleic acid detection assay (observable entity)
934651000000102,Human T-lymphotropic virus 2 ribonucleic acid detection assay (procedure)
1008311000000101,Human T-lymphotropic virus 2 ribonucleic acid detection assay (observable entity)
934671000000106,Human T-lymphotropic virus provirus deoxyribonucleic acid detection assay (procedure)
1008301000000103,Human T-lymphotropic virus provirus deoxyribonucleic acid detection assay (observable entity)
934711000000107,Human T-lymphotropic virus ribonucleic acid detection assay (procedure)
1008291000000102,Human T-lymphotropic virus ribonucleic acid detection assay (observable entity)
934771000000102,Human papilloma virus deoxyribonucleic acid detection assay (procedure)
1008271000000101,Human papilloma virus deoxyribonucleic acid detection assay (observable entity)
310052009,Genitourinary medicine service (procedure)
310062002,Pregnancy termination service (qualifier value)
13961000000108,HSA1 form status (finding)
13971000000101,Form A therapeutic abortion form status (finding)
14021000000103,Investigation of complaint by Mental Health Act Commissioner (procedure)
310506006,Reason for termination of pregnancy (observable entity)
310506006,Reason for termination of pregnancy (observable entity)
310507002,Risk to life of pregnant woman greater than if pregnancy terminated (finding)
365565007,Finding of legal affairs and legal constraints (finding)
310506006,Reason for termination of pregnancy (observable entity)
310508007,To prevent grave perm inj to phys/mental health pregn woman (finding)
365565007,Finding of legal affairs and legal constraints (finding)
310506006,Reason for termination of pregnancy (observable entity)
310509004,Pregnancy of less than 24 weeks involving risk of injury for the physical or mental health of the pregnant woman (finding)
365565007,Finding of legal affairs and legal constraints (finding)
310506006,Reason for termination of pregnancy (observable entity)
310510009,Pregnancy of less than 24 weeks involving risk of injury for health of existing child of pregnant woman (finding)
365565007,Finding of legal affairs and legal constraints (finding)
310506006,Reason for termination of pregnancy (observable entity)
310511008,Unborn child at risk from abnorms as to be serious handicap (finding)
365565007,Finding of legal affairs and legal constraints (finding)
310861008,Chlamydia antigen test (procedure)
1031431000000104,Chlamydia antigen test (observable entity)
310862001,Chlamydia antigen by enzyme-linked immunosorbent assay (procedure)
311875008,[V]Family history of physical abuse to sibling (situation)
463621000000100,[V]Family history of physical abuse to sibling (situation)
311876009,[V]Family history of physical abuse to sibling by family member (situation)
480101000000105,[V]Family history of physical abuse to sibling by family member (situation)
311877000,[V]Family history of sexual abuse to sibling (situation)
428431000000103,[V]Family history of sexual abuse to sibling (situation)
311878005,[V]Family history of sexual abuse to sibling by family member (situation)
410111000000109,[V]Family history of sexual abuse to sibling by family member (situation)
311879002,[V]Family history of mental abuse to sibling (situation)
416351000000108,[V]Family history of mental abuse to sibling (situation)
311880004,[V]Family history of mental abuse to sibling by family member (situation)
452921000000106,[V]Family history of mental abuse to sibling by family member (situation)
